{
  "chapter_number": 6,
  "chapter_mission": "Ben arrives at Tarn Velos Coastal Detention Works, a storm-lashed industrial coastal prison. He moves through processing under his low-profile cover as a GA Justice records auditor and is shown to the visitor room. Talon is brought in. Talon enters as quick, funny, restless, and difficult. He recognizes the duplicated manifest fragment as a cloned shipment identity, not a clerical mistake, and clocks Ben as Skywalker, Jedi, and former GAG. His jokes test Ben, hide fear, and keep the visitor room from becoming solemn. Include a humanizing prison-habit beat: Talon sits where he can see the door, counts guards mid-joke, keeps his hands visible, pockets food automatically, or otherwise reveals how prison trained his body before he can hide it.",
  "chapter_turn": "The prison alarm changes pitch; Talon notices it is wrong.",
  "structural_phase": "setup",
  "pov_allocation": [
    "Ben"
  ],
  "scene_count": 1,
  "scene_plan": [
    {
      "scene_number": 1,
      "role": "escalation",
      "dialogue_expectation": "dialogue_led",
      "target_word_count": 3500,
      "purpose": "Ben arrives at Tarn Velos Coastal Detention Works, a storm-lashed industrial coastal prison. He moves through processing under his low-profile cover as a GA Justice records auditor and is shown to the visitor room."
    }
  ],
  "reveal_payload": [],
  "hook_movements": {
    "planted": [
      "HK_03"
    ],
    "advanced": [],
    "resolved": []
  },
  "subplot_obligations": [
    "SUB_01"
  ],
  "relationship_turns": [],
  "pacing_curve": "rising",
  "exit_vector": "The prison alarm changes pitch; Talon notices it is wrong.",
  "chapter_word_target": 3500,
  "notes": "Source: Chapter Outlines v4.1. Act: Act One — The Body / The Prison / The Partnership. Chapter title: Visitor Room.\n\nContinuity note: This is the consolidated arrival-and-meeting chapter (formerly Chapters 7 and 8). Ben’s arrival at the prison is the opening beat; Talon’s entry into the visitor room is the chapter’s hinge.\n\nCharacter voice focus: preserve the exact v1.4 character behavior and dialogue rules for the chapter POV and named participants. Plot first, character second, theme through consequences."
}
