{
  "chapter_number": 13,
  "chapter_mission": "Iressa reconstructs the damaged manifest trail using legitimate Civitas tools and hidden old-GAG habits beneath them. She does not simply break Jacen’s encryption; she reconstructs around it through surrounding records: inspection gaps, correction logs, duplicate cargo seals, quarantine overrides, loading dock scans, archive timestamps, and records damaged in the same shape. The serious work happens not at Civitas but at her secondary cache — a quiet leased space she maintains off-record, away from her professional life. She mentions it briefly to Ben and Talon in passing, more to assert her own privacy than to brief them. She identifies a decommissioned GAG quarantine archive / cargo records site where the hidden copy can be proven. Ben, Talon, and Iressa then enter the old quarantine archive / cargo records site. Iressa starts splitting/corrupting data so the enemy cannot get a clean copy while preserving enough proof for Ben and Talon.",
  "chapter_turn": "The archive wakes. Iressa realizes someone else has recently queried or guarded the same buried records, and now they have arrived.",
  "structural_phase": "response",
  "pov_allocation": [
    "Ben"
  ],
  "scene_count": 1,
  "scene_plan": [
    {
      "scene_number": 1,
      "role": "escalation",
      "dialogue_expectation": "balanced",
      "target_word_count": 3500,
      "purpose": "Iressa reconstructs the damaged manifest trail using legitimate Civitas tools and hidden old-GAG habits beneath them. She does not simply break Jacen’s encryption; she reconstructs around it through surrounding records: inspection gaps, correction logs, duplicate cargo seals, quarantine overrides, loading dock scans, archive timestamps, and records damaged in the same shape."
    }
  ],
  "reveal_payload": [],
  "hook_movements": {
    "planted": [],
    "advanced": [],
    "resolved": []
  },
  "subplot_obligations": [
    "SUB_02",
    "SUB_05"
  ],
  "relationship_turns": [],
  "pacing_curve": "rising",
  "exit_vector": "The archive wakes. Iressa realizes someone else has recently queried or guarded the same buried records, and now they have arrived.",
  "chapter_word_target": 3500,
  "notes": "Source: Chapter Outlines v4.1. Act: Act One — The Body / The Prison / The Partnership. Chapter title: The Index Under the Index.\n\nContinuity note: This is the consolidated reconstruction-and-archive chapter (formerly Chapters 17 and 18). Iressa’s secondary cache is established here as a passing detail — one line, no emphasis. It will become the target of PP2.\n\nCharacter voice focus: preserve the exact v1.4 character behavior and dialogue rules for the chapter POV and named participants. Plot first, character second, theme through consequences."
}
