{
  "chapter_number": 16,
  "chapter_mission": "Put Veraine on the page, let her case land at full strength, and bring the group back from the meeting with more pressure than certainty.",
  "chapter_turn": "Ben finally meets the mind he has been tracking and learns that talking to Veraine is part of fighting her, not a pause from it.",
  "structural_phase": "attack",
  "pov_allocation": [
    "Ben Skywalker"
  ],
  "scene_count": 4,
  "scene_plan": [
    {
      "scene_number": 1,
      "role": "hook",
      "dialogue_expectation": "dialogue_led",
      "target_word_count": 1000,
      "purpose": "Start with the shipboard debate over taking the meeting and let Ben choose before the room settles."
    },
    {
      "scene_number": 2,
      "role": "reveal",
      "dialogue_expectation": "dialogue_led",
      "target_word_count": 1300,
      "purpose": "At the meeting, let Veraine speak by questioning, especially when she turns toward Kael."
    },
    {
      "scene_number": 3,
      "role": "escalation",
      "dialogue_expectation": "balanced",
      "target_word_count": 1200,
      "purpose": "Give Sera one experiential answer Veraine cannot absorb cleanly, while Ben gathers what he can by watching."
    },
    {
      "scene_number": 4,
      "role": "escalation",
      "dialogue_expectation": "balanced",
      "target_word_count": 800,
      "purpose": "Back aboard ship, let the group process the encounter and feel that Veraine left them worse off, without yet explaining how."
    }
  ],
  "reveal_payload": [
    "R09"
  ],
  "hook_movements": {
    "planted": [
      "H16"
    ],
    "advanced": [],
    "resolved": [
      "H05",
      "H10"
    ]
  },
  "subplot_obligations": [
    "SP-A",
    "SP1",
    "SP2",
    "SP3"
  ],
  "relationship_turns": [
    {
      "dyad": "Ben/Veraine",
      "from": "absent antagonist; named but invisible",
      "to": "direct contact — Ben has now heard her voice, watched her hands, met her argument at full strength. She is formidable and human. He will not be able to fight a cartoon again. Per W2, his emergent intelligence from the meeting is the load-bearing takeaway: he has mapped her register and her ship's approach, even without scripted intelligence-gathering beats."
    },
    {
      "dyad": "Kael/Veraine",
      "from": "parallel recognition (Ch 10 message)",
      "to": "direct recruitment — her pitch has landed. Kael did not accept. He did not refuse either. The pull is real and the decision is not yet made"
    },
    {
      "dyad": "Sera/Veraine",
      "from": "parallel lives (both anchors, both survivors)",
      "to": "shared wound, opposite scar — Sera's testimony is the one argument Veraine cannot academically dismiss. Veraine's sharpened question in response is the chapter's most important gesture — a woman who asks more specifically when cornered rather than attacks"
    }
  ],
  "pacing_curve": "rising",
  "exit_vector": "Veraine's ship receding. The group in the clearing holding the weight of what just passed. Ben's understanding overtaking him in retrospect — something in the meeting was not the meeting. The sabotage the Force will reveal at Ch 17 s1 has already happened; the reader does not yet know. Ch 17 opens with the discovery.",
  "chapter_word_target": 4300,
  "notes": "Take Veraine seriously. The chapter works only if she feels intelligent, composed, and morally coherent from her own angle. Do not solve the meeting inside the meeting."
}
