{
  "chapter_number": 18,
  "chapter_mission": "Talon identifies Korda as old GAG security system in respectable clothing. Korda’s presence implies the Foundation is operationally compromised by old GAG-linked security and records access. Talon’s humor thins out — Korda makes Talon feel contaminated by his own past, not merely suspicious. Using Iressa’s tools, Talon submits a fake manifest correction / records query that makes it look as if a missing piece of the Jacen-sealed duplicate manifest has resurfaced. The signal is boring enough to look bureaucratic, but specific enough that anyone guarding the old shipment trail will notice. This is not just hacking. Talon uses the shape of his old compromised work as bait, putting an old version of himself back on the board.",
  "chapter_turn": "Korda responds indirectly.",
  "structural_phase": "attack",
  "pov_allocation": [
    "Talon",
    "Ben"
  ],
  "scene_count": 1,
  "scene_plan": [
    {
      "scene_number": 1,
      "role": "escalation",
      "dialogue_expectation": "balanced",
      "target_word_count": 2800,
      "purpose": "Talon identifies Korda as old GAG security system in respectable clothing. Korda’s presence implies the Foundation is operationally compromised by old GAG-linked security and records access."
    }
  ],
  "reveal_payload": [],
  "hook_movements": {
    "planted": [],
    "advanced": [],
    "resolved": []
  },
  "subplot_obligations": [
    "SUB_01",
    "SUB_04",
    "SUB_05"
  ],
  "relationship_turns": [],
  "pacing_curve": "rising",
  "exit_vector": "Korda responds indirectly.",
  "chapter_word_target": 2800,
  "notes": "Source: Chapter Outlines v4.1. Act: Act One — The Body / The Prison / The Partnership. Chapter title: Manifest Correction.\n\nContinuity note: This is the consolidated Korda-spotted-and-trap-set chapter (formerly Chapters 23 and 24).\n\nCharacter voice focus: preserve the exact v1.4 character behavior and dialogue rules for the chapter POV and named participants. Plot first, character second, theme through consequences."
}
