{
  "chapter_number": 5,
  "chapter_mission": "Ben and Inspector Cale Dorrin cross-reference the fragment’s surviving GAG audit/handler marker against Elya’s old assignment logs, supervision records, and postwar prosecution files. Dorrin discovers that Talon Veyr worked under Elya in the records/logistics environment after Maro Tess reassigned him out of field duty, and that Talon’s later transfer-chain conviction involved manifest/authorization patterns close to the recovered fragment. Ben identifies Talon as the person likely to recognize the shipment fraud pattern, not as a magic decoder. Ben tries the legal route first, using Dorrin’s lawful access and Luke’s quiet support rather than a prison break.",
  "chapter_turn": "Ben departs for Tarn Velos.",
  "structural_phase": "setup",
  "pov_allocation": [
    "Ben"
  ],
  "scene_count": 1,
  "scene_plan": [
    {
      "scene_number": 1,
      "role": "escalation",
      "dialogue_expectation": "balanced",
      "target_word_count": 1800,
      "purpose": "Ben and Inspector Cale Dorrin cross-reference the fragment’s surviving GAG audit/handler marker against Elya’s old assignment logs, supervision records, and postwar prosecution files. Dorrin discovers that Talon Veyr worked under Elya in the records/logistics environment after Maro Tess reassigned him out of field duty, and that Talon’s later transfer-chain conviction involved manifest/authorization patterns close to the recovered fragment."
    }
  ],
  "reveal_payload": [],
  "hook_movements": {
    "planted": [],
    "advanced": [],
    "resolved": []
  },
  "subplot_obligations": [],
  "relationship_turns": [],
  "pacing_curve": "rising",
  "exit_vector": "Ben departs for Tarn Velos.",
  "chapter_word_target": 1800,
  "notes": "Source: Chapter Outlines v4.1. Act: Act One — The Body / The Prison / The Partnership. Chapter title: The Man Who Can Read It.\n\nReader-facing clarity note: Ben does the responsible thing. Dorrin finds relevance, not certainty: Talon worked under Elya and later got convicted around similar records machinery. That responsible legal query is what alerts the people watching old GAG case files and manifest markers.\n\nCharacter voice focus: preserve the exact v1.4 character behavior and dialogue rules for the chapter POV and named participants. Plot first, character second, theme through consequences."
}
