{
  "chapter_number": 25,
  "chapter_mission": "Sela guides them through Iresh and demonstrates local rules around memory-heavy places. Iresh does not cause madness; the danger is forcing memory/identity pressure into resonance.",
  "chapter_turn": "They find signs of the Foundation operation near taboo ground.",
  "structural_phase": "attack",
  "pov_allocation": [
    "Sela or Ben"
  ],
  "scene_count": 1,
  "scene_plan": [
    {
      "scene_number": 1,
      "role": "escalation",
      "dialogue_expectation": "balanced",
      "target_word_count": 2500,
      "purpose": "Sela guides them through Iresh and demonstrates local rules around memory-heavy places. Iresh does not cause madness; the danger is forcing memory/identity pressure into resonance."
    }
  ],
  "reveal_payload": [],
  "hook_movements": {
    "planted": [],
    "advanced": [],
    "resolved": []
  },
  "subplot_obligations": [
    "SUB_03"
  ],
  "relationship_turns": [],
  "pacing_curve": "rising",
  "exit_vector": "They find signs of the Foundation operation near taboo ground.",
  "chapter_word_target": 2500,
  "notes": "Source: Chapter Outlines v4.1. Act: Act Three — Iresh / Glasswell / Aevyn. Chapter title: Some Places Remember Too Loudly.\n\nCharacter voice focus: preserve the exact v1.4 character behavior and dialogue rules for the chapter POV and named participants. Plot first, character second, theme through consequences."
}
