{
  "chapter_number": 4,
  "chapter_mission": "Ben arrives on Coruscant roughly half a day after Elya sent the message. The body is not warm-on-the-floor fresh, but the investigation is fresh: access controlled, first reports unfinished, official assumptions still forming. Inspector Cale Dorrin, a GA Justice / Coruscant Security investigator assigned to sensitive old-GAG and political-crime cases, controls the scene and lets Ben in under limits because Elya’s message makes him relevant and Luke has quietly vouched for the urgency. Ben senses Force-trauma and recovers the damaged Jacen-sealed duplicate manifest fragment hidden by Elya’s records instincts, not in an obvious safe.",
  "chapter_turn": "Dorrin’s first records check points toward an old GAG personnel/prosecution trail Ben cannot interpret alone.",
  "structural_phase": "setup",
  "pov_allocation": [
    "Ben"
  ],
  "scene_count": 1,
  "scene_plan": [
    {
      "scene_number": 1,
      "role": "reveal",
      "dialogue_expectation": "balanced",
      "target_word_count": 2500,
      "purpose": "Ben arrives on Coruscant roughly half a day after Elya sent the message. The body is not warm-on-the-floor fresh, but the investigation is fresh: access controlled, first reports unfinished, official assumptions still forming."
    }
  ],
  "reveal_payload": [
    "R_02",
    "R_03"
  ],
  "hook_movements": {
    "planted": [],
    "advanced": [],
    "resolved": []
  },
  "subplot_obligations": [],
  "relationship_turns": [],
  "pacing_curve": "rising",
  "exit_vector": "Dorrin’s first records check points toward an old GAG personnel/prosecution trail Ben cannot interpret alone.",
  "chapter_word_target": 2500,
  "notes": "Source: Chapter Outlines v4.1. Act: Act One — The Body / The Prison / The Partnership. Chapter title: Not Well (Inciting Incident).\n\nReader-facing clarity note: The fragment is not enough to solve the case. It shows a duplicated shipment identity, a quarantine/survey disguise, Jacen’s personal encryption marker, and a partial GAG logistics/audit trace. Dorrin can validate the official case context and preserve access, but he cannot interpret what the fragment means.\n\nCharacter voice focus: preserve the exact v1.4 character behavior and dialogue rules for the chapter POV and named participants. Plot first, character second, theme through consequences."
}
