{
  "chapter_number": 24,
  "chapter_mission": "Ben and Talon arrive on Iresh. The Foundation/Vigil expedition is already present under legitimate cover. The book’s texture shifts from Coruscant conspiracy to strange-world expedition: wind, pale cliffs, dark water, chimes, black reeds, thin settlement lights, suspicious locals, and too much quiet. A local contact sends them to Sela Dray. Before they ask for help, the reader sees Sela in the middle of ordinary local responsibility: repairing a chime line, arguing over supply access, helping a neighbor, fixing a path marker, or dealing with someone asking about Tavi. Sela refuses Ben and Talon at first because offworlders have already harmed her home. Tavi Dray is missing after taking Foundation money or pressure to guide the expedition. The Foundation has blocked paths, ignored local warnings, brought armed security, and disrupted supply/transport access. Sela eventually agrees to help because finding Tavi and stopping the offworlders overlap.",
  "chapter_turn": "Sela agrees to help — on her terms, not theirs.",
  "structural_phase": "attack",
  "pov_allocation": [
    "Ben"
  ],
  "scene_count": 1,
  "scene_plan": [
    {
      "scene_number": 1,
      "role": "escalation",
      "dialogue_expectation": "balanced",
      "target_word_count": 3500,
      "purpose": "Ben and Talon arrive on Iresh. The Foundation/Vigil expedition is already present under legitimate cover."
    }
  ],
  "reveal_payload": [],
  "hook_movements": {
    "planted": [],
    "advanced": [],
    "resolved": []
  },
  "subplot_obligations": [
    "SUB_03"
  ],
  "relationship_turns": [],
  "pacing_curve": "rising",
  "exit_vector": "Sela agrees to help — on her terms, not theirs.",
  "chapter_word_target": 3500,
  "notes": "Source: Chapter Outlines v4.1. Act: Act Three — Iresh / Glasswell / Aevyn. Chapter title: Iresh Wind.\n\nContinuity note: This is the consolidated arrival-and-Sela-refusal chapter (formerly Chapters 31 and 32).\n\nCharacter voice focus: preserve the exact v1.4 character behavior and dialogue rules for the chapter POV and named participants. Plot first, character second, theme through consequences."
}
