{
  "chapter_number": 32,
  "chapter_mission": "Aevyn turns fully on Ben. His unstable cold white-blue blade becomes the first sustained lightsaber duel of the book. The duel happens across the collapsing Glasswell: rising water, cracking pale mineral, broken survey scaffolds, mirror-lake reflections, unstable holocron cache nearby, Aevyn’s cold white-blue unstable blade fracturing more visibly when his control strains, and Ben’s steadier Jedi blade. The fight is not simply Jedi versus dark sider. It is two students of Jacen arguing through action over what his lessons mean. Aevyn uses a technique that hits something buried in Ben — the corridor moment surfaces as a fragment for Aevyn here, never as exposition. Ben wins by using what Jacen taught him without surrendering ownership of himself. He does not violate Aevyn’s mind and does not pretend Jacen taught him nothing real.",
  "chapter_turn": "Aevyn is defeated as the Glasswell gives way.",
  "structural_phase": "climax",
  "pov_allocation": [
    "Ben"
  ],
  "scene_count": 1,
  "scene_plan": [
    {
      "scene_number": 1,
      "role": "escalation",
      "dialogue_expectation": "dialogue_led",
      "target_word_count": 4500,
      "purpose": "Aevyn turns fully on Ben. His unstable cold white-blue blade becomes the first sustained lightsaber duel of the book."
    }
  ],
  "reveal_payload": [],
  "hook_movements": {
    "planted": [],
    "advanced": [],
    "resolved": [
      "HK_06"
    ]
  },
  "subplot_obligations": [
    "SUB_05"
  ],
  "relationship_turns": [],
  "pacing_curve": "rising",
  "exit_vector": "Aevyn is defeated as the Glasswell gives way.",
  "chapter_word_target": 4500,
  "notes": "Source: Chapter Outlines v4.1. Act: Act One — The Body / The Prison / The Partnership. Chapter title: What He Left (Climax).\n\nContinuity note: This is the consolidated duel-and-victory chapter (formerly Chapters 40 and 41). The climax functions as one sustained beat rather than two.\n\nCharacter voice focus: preserve the exact v1.4 character behavior and dialogue rules for the chapter POV and named participants. Plot first, character second, theme through consequences."
}
