{
  "chapter_number": 12,
  "chapter_mission": "Talon finds Iressa by baiting an old private debt-marker through a legitimate records-correction channel. Ben and Talon interrupt Iressa during an ordinary workday at Civitas Archive Systems, a respectable civic-records restoration and compliance firm. Iressa is now a former GAG Manifest Integrity Analyst: she knows duplicate manifests, quarantine classifications, restricted transfer corrections, and the difference between clerical damage and deliberate concealment. She denies knowing Talon before proving she does, moves them away from coworkers/security/cameras, charges a “Jedi complication fee,” lies about her exits, and changes the amount Talon owes her every time she mentions it. Civitas office beat: Give Iressa one coworker or ordinary office-life interaction before the old world swallows her day: someone calls her by her clean professional name, reminds her about a meeting, complains about a shared report, or asks whether she is still coming to lunch. Iressa lies smoothly to protect that person from Ben/Talon and from the trouble following them. Civitas lunchroom beat: While Iressa manages the disruption, Ben briefly waits in an employee lunchroom / visitor break area. An ordinary Civitas employee notices that he looks familiar but cannot immediately place him. Ben is polite but awkward, bracing for recognition as Luke’s son, Mara’s son, Jacen/Caedus’s survivor, the former GAG boy, or a Jedi from the war years. Instead, he is pulled into painfully normal small talk. The employee offers him half a sandwich — “you look like one of those guys who forgets to eat” — and asks if he works in compliance. Ben takes the food, answers vaguely, feels ridiculous standing there with a murder clue in his pocket while making office-real small talk about caf and record migrations.",
  "chapter_turn": "Iressa recognizes the fragment as a cloned shipment identity under quarantine/survey disguise, not a simple duplicate.",
  "structural_phase": "response",
  "pov_allocation": [
    "Talon or Ben"
  ],
  "scene_count": 1,
  "scene_plan": [
    {
      "scene_number": 1,
      "role": "escalation",
      "dialogue_expectation": "dialogue_led",
      "target_word_count": 3500,
      "purpose": "Talon finds Iressa by baiting an old private debt-marker through a legitimate records-correction channel. Ben and Talon interrupt Iressa during an ordinary workday at Civitas Archive Systems, a respectable civic-records restoration and compliance firm."
    }
  ],
  "reveal_payload": [
    "R_04"
  ],
  "hook_movements": {
    "planted": [],
    "advanced": [],
    "resolved": []
  },
  "subplot_obligations": [
    "SUB_02"
  ],
  "relationship_turns": [],
  "pacing_curve": "rising",
  "exit_vector": "Iressa recognizes the fragment as a cloned shipment identity under quarantine/survey disguise, not a simple duplicate.",
  "chapter_word_target": 3500,
  "notes": "Source: Chapter Outlines v4.1. Act: Act One — The Body / The Prison / The Partnership. Chapter title: Iressa Vossk Does Not Know You.\n\nReader-onboarding note: Iressa’s job should show how former GAG-adjacent people survived after the war: by becoming boring, useful, and respectable. Talon finds her because he knows how she lies.\n\nCharacter voice focus: preserve the exact v1.4 character behavior and dialogue rules for the chapter POV and named participants. Plot first, character second, theme through consequences."
}
