{
  "chapter_number": 10,
  "chapter_mission": "Aftermath of the escape. Luke begins containing the fallout from a distance, calling in what favors he still has, while Dorrin becomes the strained official contact caught between “Ben may be right” and “Ben just helped a convicted prisoner escape.” Talon, exhausted and still defensive, gives Ben the next lead: Iressa Vossk.",
  "chapter_turn": "Act turn. Ben and Talon return to Coruscant together, compromised and hunted. Talon joins not out of gratitude, but because the attack proves the lie that ruined him was only one layer of something larger. # Act Two — Coruscant Investigation / Foundation / The Vigil Act purpose: Ben and Talon become a real investigative pair, Iressa’s death teaches Ben that restraint can cost lives, and the GAG trail leads through the Foundation, Korda, Tess, and finally to Iresh.",
  "structural_phase": "response",
  "pov_allocation": [
    "Ben"
  ],
  "scene_count": 1,
  "scene_plan": [
    {
      "scene_number": 1,
      "role": "escalation",
      "dialogue_expectation": "balanced",
      "target_word_count": 1800,
      "purpose": "Aftermath of the escape. Luke begins containing the fallout from a distance, calling in what favors he still has, while Dorrin becomes the strained official contact caught between “Ben may be right” and “Ben just helped a convicted prisoner escape.” Talon, exhausted and still defensive, gives Ben the next lead: Iressa Vossk."
    }
  ],
  "reveal_payload": [],
  "hook_movements": {
    "planted": [],
    "advanced": [],
    "resolved": []
  },
  "subplot_obligations": [],
  "relationship_turns": [],
  "pacing_curve": "steady",
  "exit_vector": "Act turn. Ben and Talon return to Coruscant together, compromised and hunted. Talon joins not out of gratitude, but because the attack proves the lie that ruined him was only one layer of something larger. # Act Two — Coruscant Investigation / Foundation / The Vigil Act purpose: Ben and Talon become a real investigative pair, Iressa’s death teaches Ben that restraint can cost lives, and the GAG trail leads through the Foundation, Korda, Tess, and finally to Iresh.",
  "chapter_word_target": 1800,
  "notes": "Source: Chapter Outlines v4.1. Act: Act One — The Body / The Prison / The Partnership. Chapter title: Iressa Vossk.\n\nCharacter voice focus: preserve the exact v1.4 character behavior and dialogue rules for the chapter POV and named participants. Plot first, character second, theme through consequences."
}
