{
  "chapter_number": 29,
  "chapter_mission": "The group discovers Jacen’s cache was hidden in old offworld survey/GAG storage equipment near the Glasswell, not in a mystical altar. Talon recognizes the storage logic. Ben recognizes the Force wrongness. Sela recognizes the local danger. When they get close enough to scan the outer data layers, Ben confirms what Iressa told them in her dying transmission at the Midpoint: the holocron is unfinished, containing Jacen’s work on Recognition, Deepening, and Holding — exactly the identity-shaping techniques the Vigil intends to weaponize with Aevyn’s help. The SPP function here is embodiment rather than revelation. Ben already knew (from Iressa) what the holocron was for. Seeing the cache, seeing Aevyn already at work on it, makes the threat concrete. There is no way to stop Aevyn from getting at the holocron cleanly. The only options left are rescue (saving Tavi and the locals from what Aevyn’s work is about to break) and denial (keeping Aevyn from leaving with the full prize).",
  "chapter_turn": "Aevyn begins forcing the cache open. The Glasswell starts to answer.",
  "structural_phase": "second_plot_point",
  "pov_allocation": [
    "Talon or Ben"
  ],
  "scene_count": 1,
  "scene_plan": [
    {
      "scene_number": 1,
      "role": "reveal",
      "dialogue_expectation": "dialogue_led",
      "target_word_count": 3200,
      "purpose": "The group discovers Jacen’s cache was hidden in old offworld survey/GAG storage equipment near the Glasswell, not in a mystical altar. Talon recognizes the storage logic."
    }
  ],
  "reveal_payload": [
    "R_10"
  ],
  "hook_movements": {
    "planted": [],
    "advanced": [],
    "resolved": [
      "HK_05"
    ]
  },
  "subplot_obligations": [
    "SUB_03",
    "SUB_05"
  ],
  "relationship_turns": [],
  "pacing_curve": "rising",
  "exit_vector": "Aevyn begins forcing the cache open. The Glasswell starts to answer.",
  "chapter_word_target": 3200,
  "notes": "Source: Chapter Outlines v4.1. Act: Act One — The Body / The Prison / The Partnership. Chapter title: The Cache Site (Second Plot Point).\n\nCharacter voice focus: preserve the exact v1.4 character behavior and dialogue rules for the chapter POV and named participants. Plot first, character second, theme through consequences."
}
